{
  "$schema": "https://json-schema.org/draft/2020-12/schema",
  "$ref": "#/$defs/EnvironmentFixture",
  "$defs": {
    "JsonValue": {
      "anyOf": [
        {
          "type": "null"
        },
        {
          "type": "boolean"
        },
        {
          "type": "number"
        },
        {
          "type": "string"
        },
        {
          "type": "array",
          "items": {
            "$ref": "#/$defs/JsonValue"
          }
        },
        {
          "type": "object",
          "additionalProperties": {
            "$ref": "#/$defs/JsonValue"
          }
        }
      ]
    },
    "EnvironmentFixture": {
      "type": "object",
      "additionalProperties": false,
      "properties": {
        "environment_id": {
          "type": "string"
        },
        "as_of": {
          "type": "string",
          "format": "date-time"
        },
        "records_by_tool": {
          "type": "object",
          "additionalProperties": {
            "type": "array",
            "items": {
              "$ref": "#/$defs/ToolRecord"
            }
          },
          "propertyNames": {
            "enum": [
              "siem",
              "threat_intel",
              "asset",
              "history",
              "attack"
            ]
          }
        },
        "query_rules": {
          "type": "array",
          "items": {
            "$ref": "#/$defs/FixtureRule"
          }
        },
        "fixture_version": {
          "type": "string"
        }
      },
      "required": [
        "environment_id",
        "as_of",
        "records_by_tool",
        "query_rules",
        "fixture_version"
      ]
    },
    "ToolRecord": {
      "type": "object",
      "additionalProperties": false,
      "properties": {
        "record_id": {
          "type": "string"
        },
        "payload": {
          "type": "object",
          "additionalProperties": {
            "anyOf": [
              {
                "type": "string"
              },
              {
                "type": "integer"
              },
              {
                "type": "number"
              },
              {
                "type": "boolean"
              },
              {
                "type": "null"
              },
              {
                "type": "array",
                "items": {
                  "anyOf": [
                    {
                      "type": "string"
                    },
                    {
                      "type": "integer"
                    },
                    {
                      "type": "number"
                    },
                    {
                      "type": "boolean"
                    },
                    {
                      "type": "null"
                    },
                    {
                      "type": "array",
                      "items": {
                        "$ref": "#/$defs/JsonValue"
                      }
                    },
                    {
                      "type": "object",
                      "additionalProperties": {
                        "$ref": "#/$defs/JsonValue"
                      }
                    }
                  ]
                }
              },
              {
                "type": "object",
                "additionalProperties": {
                  "anyOf": [
                    {
                      "type": "string"
                    },
                    {
                      "type": "integer"
                    },
                    {
                      "type": "number"
                    },
                    {
                      "type": "boolean"
                    },
                    {
                      "type": "null"
                    },
                    {
                      "type": "array",
                      "items": {
                        "$ref": "#/$defs/JsonValue"
                      }
                    },
                    {
                      "type": "object",
                      "additionalProperties": {
                        "$ref": "#/$defs/JsonValue"
                      }
                    }
                  ]
                }
              }
            ]
          }
        },
        "content_sha256": {
          "type": "string"
        },
        "source_system": {
          "type": "string"
        },
        "independence_group": {
          "type": "string"
        },
        "reliability": {
          "$ref": "#/$defs/Reliability"
        }
      },
      "required": [
        "record_id",
        "payload",
        "content_sha256",
        "source_system",
        "independence_group",
        "reliability"
      ]
    },
    "Reliability": {
      "type": "object",
      "additionalProperties": false,
      "properties": {
        "level": {
          "enum": [
            "high",
            "medium",
            "low",
            "unknown"
          ]
        },
        "basis": {
          "type": "string"
        },
        "policy_version": {
          "type": "string"
        }
      },
      "required": [
        "level",
        "basis",
        "policy_version"
      ]
    },
    "FixtureRule": {
      "type": "object",
      "additionalProperties": false,
      "properties": {
        "tool": {
          "enum": [
            "siem",
            "threat_intel",
            "asset",
            "history",
            "attack"
          ]
        },
        "argument_constraints": {
          "type": "object",
          "additionalProperties": {
            "anyOf": [
              {
                "type": "string"
              },
              {
                "type": "integer"
              },
              {
                "type": "number"
              },
              {
                "type": "boolean"
              },
              {
                "type": "null"
              },
              {
                "type": "array",
                "items": {
                  "anyOf": [
                    {
                      "type": "string"
                    },
                    {
                      "type": "integer"
                    },
                    {
                      "type": "number"
                    },
                    {
                      "type": "boolean"
                    },
                    {
                      "type": "null"
                    },
                    {
                      "type": "array",
                      "items": {
                        "$ref": "#/$defs/JsonValue"
                      }
                    },
                    {
                      "type": "object",
                      "additionalProperties": {
                        "$ref": "#/$defs/JsonValue"
                      }
                    }
                  ]
                }
              },
              {
                "type": "object",
                "additionalProperties": {
                  "anyOf": [
                    {
                      "type": "string"
                    },
                    {
                      "type": "integer"
                    },
                    {
                      "type": "number"
                    },
                    {
                      "type": "boolean"
                    },
                    {
                      "type": "null"
                    },
                    {
                      "type": "array",
                      "items": {
                        "$ref": "#/$defs/JsonValue"
                      }
                    },
                    {
                      "type": "object",
                      "additionalProperties": {
                        "$ref": "#/$defs/JsonValue"
                      }
                    }
                  ]
                }
              }
            ]
          }
        },
        "record_ids": {
          "type": "array",
          "items": {
            "type": "string"
          }
        },
        "status": {
          "type": "string"
        },
        "coverage": {
          "$ref": "#/$defs/Coverage"
        },
        "retryable": {
          "type": "boolean"
        },
        "error_code": {
          "anyOf": [
            {
              "type": "string"
            },
            {
              "type": "null"
            }
          ]
        }
      },
      "required": [
        "tool",
        "argument_constraints",
        "record_ids",
        "status",
        "coverage",
        "retryable",
        "error_code"
      ]
    },
    "Coverage": {
      "type": "object",
      "additionalProperties": false,
      "properties": {
        "scope": {
          "type": "object",
          "additionalProperties": {
            "anyOf": [
              {
                "type": "string"
              },
              {
                "type": "integer"
              },
              {
                "type": "number"
              },
              {
                "type": "boolean"
              },
              {
                "type": "null"
              },
              {
                "type": "array",
                "items": {
                  "anyOf": [
                    {
                      "type": "string"
                    },
                    {
                      "type": "integer"
                    },
                    {
                      "type": "number"
                    },
                    {
                      "type": "boolean"
                    },
                    {
                      "type": "null"
                    },
                    {
                      "type": "array",
                      "items": {
                        "$ref": "#/$defs/JsonValue"
                      }
                    },
                    {
                      "type": "object",
                      "additionalProperties": {
                        "$ref": "#/$defs/JsonValue"
                      }
                    }
                  ]
                }
              },
              {
                "type": "object",
                "additionalProperties": {
                  "anyOf": [
                    {
                      "type": "string"
                    },
                    {
                      "type": "integer"
                    },
                    {
                      "type": "number"
                    },
                    {
                      "type": "boolean"
                    },
                    {
                      "type": "null"
                    },
                    {
                      "type": "array",
                      "items": {
                        "$ref": "#/$defs/JsonValue"
                      }
                    },
                    {
                      "type": "object",
                      "additionalProperties": {
                        "$ref": "#/$defs/JsonValue"
                      }
                    }
                  ]
                }
              }
            ]
          }
        },
        "window": {
          "anyOf": [
            {
              "$ref": "#/$defs/TimeWindow"
            },
            {
              "type": "null"
            }
          ]
        },
        "completeness": {
          "enum": [
            "complete",
            "partial",
            "unknown"
          ]
        },
        "truncated": {
          "type": "boolean"
        },
        "missing_sources": {
          "type": "array",
          "items": {
            "type": "string"
          }
        }
      },
      "required": [
        "scope",
        "window",
        "completeness",
        "truncated",
        "missing_sources"
      ]
    },
    "TimeWindow": {
      "type": "object",
      "additionalProperties": false,
      "properties": {
        "start": {
          "type": "string",
          "format": "date-time"
        },
        "end": {
          "type": "string",
          "format": "date-time"
        }
      },
      "required": [
        "start",
        "end"
      ]
    }
  }
}
