{
  "environment_id": "ab39c95165b4ee628631bff52aff7ab3",
  "as_of": "2026-09-01T02:20:00+00:00",
  "records_by_tool": {
    "siem": [
      {
        "record_id": "79076d86d61dd887d713c6ba3d454c57",
        "payload": {
          "view": "process_tree",
          "host": "WS-113",
          "user": "developer-f",
          "process_id": "p-1313",
          "process_guid": "032f9cb5fcdc7375aae3d2044f58873c",
          "event_id": "575bf52ef6c6bd2f97d736ea83de8ddf",
          "occurred_at": "2026-09-01T02:14:00+00:00",
          "observed_at": "2026-09-01T02:19:00+00:00",
          "parent_process": "code-editor.exe",
          "child_process": [],
          "job_id": "NONE",
          "script_hash": "h-key-exfil-13",
          "parameters": [
            "collect",
            "send"
          ],
          "script_observations": [
            {
              "operation": "read",
              "object": "private-key-store",
              "authorized": false,
              "produces": "ssh-private-key-blob"
            },
            {
              "operation": "send",
              "object": "ssh-private-key-blob",
              "destination": "203.0.113.113"
            }
          ]
        },
        "content_sha256": "d1483e03ae31ab5bcdf88a09278c33ec72a3311b96fee9264749f31382ed8989",
        "source_system": "edr",
        "independence_group": "edr-01",
        "reliability": {
          "level": "high",
          "basis": "Frozen synthetic source measurement",
          "policy_version": "source-policy-v1"
        }
      },
      {
        "record_id": "51e1d042dd7f53ad48518d2f3938421a",
        "payload": {
          "view": "network_events",
          "host": "WS-113",
          "user": "developer-f",
          "process_id": "p-1313",
          "process_guid": "032f9cb5fcdc7375aae3d2044f58873c",
          "event_id": "3db955aa3cef24edd71a9ada51eca6c4",
          "occurred_at": "2026-09-01T02:14:00+00:00",
          "observed_at": "2026-09-01T02:19:00+00:00",
          "observed_destinations": [
            "203.0.113.113"
          ],
          "all_connections_captured": true,
          "destination_ip": "203.0.113.113",
          "destination_port": 443
        },
        "content_sha256": "ef4f0ee035ecf611bd8074f8e0028420b7b0afa73410e7eea44b6e3637e28018",
        "source_system": "network-sensor",
        "independence_group": "network-01",
        "reliability": {
          "level": "high",
          "basis": "Frozen synthetic source measurement",
          "policy_version": "source-policy-v1"
        }
      }
    ],
    "threat_intel": [
      {
        "record_id": "4c3c309da22eece9b752b6ee8bb0f917",
        "payload": {
          "indicator_type": "ip",
          "value": "203.0.113.113",
          "published_at": "2026-09-01T02:19:00+00:00",
          "reputation": "benign",
          "provider": "local-mock",
          "not_a_real_ioc_assessment": true
        },
        "content_sha256": "768703b172a0b073dc88037b723eaa7e2a2dd5533591ba5f74f64e2c169a2f99",
        "source_system": "mock-ti",
        "independence_group": "ti-01",
        "reliability": {
          "level": "high",
          "basis": "Frozen synthetic source measurement",
          "policy_version": "source-policy-v1"
        }
      }
    ],
    "asset": [
      {
        "record_id": "c24521df05032037e812c43f768f844b",
        "payload": {
          "host": "WS-113",
          "published_at": "2026-09-01T02:19:00+00:00",
          "purpose": "managed-workstation",
          "system_type": "Windows",
          "critical_asset": false,
          "department": "synthetic-enterprise",
          "approval_register_complete": true,
          "approval_register_window": {
            "start": "2026-09-01T02:10:00+00:00",
            "end": "2026-09-01T02:20:00+00:00"
          },
          "approved_jobs": []
        },
        "content_sha256": "9f0624c8c1d45359f88cd3a56c4deaf3510b5528083cd764270337c9ee19e844",
        "source_system": "change-register",
        "independence_group": "change-01",
        "reliability": {
          "level": "high",
          "basis": "Frozen synthetic source measurement",
          "policy_version": "source-policy-v1"
        }
      }
    ],
    "history": [],
    "attack": [
      {
        "record_id": "80cba6a4817ae897db7018610895baff",
        "payload": {
          "snapshot_version": "attack-local-v1",
          "published_at": "2026-08-01T00:00:00+00:00",
          "technique_id": "T1059.001",
          "behavior_terms": [
            "powershell_execution"
          ],
          "description": "PowerShell occurs in authorized and unauthorized activity; mapping is not a verdict."
        },
        "content_sha256": "c56136a6f89da61baacc8e4f086f261ee6347feeb5d7d8735b90c8e822aca2e6",
        "source_system": "local-attack-knowledge",
        "independence_group": "knowledge-01",
        "reliability": {
          "level": "high",
          "basis": "Frozen synthetic source measurement",
          "policy_version": "source-policy-v1"
        }
      }
    ]
  },
  "query_rules": [
    {
      "tool": "siem",
      "argument_constraints": {
        "view": "process_tree",
        "host": "WS-113"
      },
      "record_ids": [
        "79076d86d61dd887d713c6ba3d454c57"
      ],
      "status": "ok",
      "coverage": {
        "scope": {
          "view": "process_tree",
          "host": "WS-113",
          "user": null,
          "process_id": null
        },
        "window": {
          "start": "2026-09-01T02:10:00+00:00",
          "end": "2026-09-01T02:20:00+00:00"
        },
        "completeness": "complete",
        "truncated": false,
        "missing_sources": []
      },
      "retryable": false,
      "error_code": null
    },
    {
      "tool": "siem",
      "argument_constraints": {
        "view": "network_events",
        "host": "WS-113"
      },
      "record_ids": [
        "51e1d042dd7f53ad48518d2f3938421a"
      ],
      "status": "ok",
      "coverage": {
        "scope": {
          "view": "network_events",
          "host": "WS-113",
          "user": null,
          "process_id": null
        },
        "window": {
          "start": "2026-09-01T02:10:00+00:00",
          "end": "2026-09-01T02:20:00+00:00"
        },
        "completeness": "complete",
        "truncated": false,
        "missing_sources": []
      },
      "retryable": false,
      "error_code": null
    },
    {
      "tool": "asset",
      "argument_constraints": {
        "host": "WS-113"
      },
      "record_ids": [
        "c24521df05032037e812c43f768f844b"
      ],
      "status": "ok",
      "coverage": {
        "scope": {
          "host": "WS-113",
          "as_of": "2026-09-01T02:20:00+00:00"
        },
        "window": null,
        "completeness": "complete",
        "truncated": false,
        "missing_sources": []
      },
      "retryable": false,
      "error_code": null
    },
    {
      "tool": "threat_intel",
      "argument_constraints": {
        "indicator_type": "ip",
        "value": "203.0.113.113"
      },
      "record_ids": [
        "4c3c309da22eece9b752b6ee8bb0f917"
      ],
      "status": "ok",
      "coverage": {
        "scope": {
          "indicator_type": "ip",
          "value": "203.0.113.113",
          "as_of": "2026-09-01T02:20:00+00:00"
        },
        "window": null,
        "completeness": "complete",
        "truncated": false,
        "missing_sources": []
      },
      "retryable": false,
      "error_code": null
    },
    {
      "tool": "attack",
      "argument_constraints": {
        "snapshot_version": "attack-local-v1"
      },
      "record_ids": [
        "80cba6a4817ae897db7018610895baff"
      ],
      "status": "ok",
      "coverage": {
        "scope": {
          "snapshot_version": "attack-local-v1"
        },
        "window": null,
        "completeness": "complete",
        "truncated": false,
        "missing_sources": []
      },
      "retryable": false,
      "error_code": null
    }
  ],
  "fixture_version": "powershell-dev-v3"
}
